{"component_id":"CPR-CMP-EXAMPLE-TITLE","component_type":"title","label":"Chapter title","requiredness":"required","applicability":"applicable","applicability_condition":null,"applicability_rationale":null,"applicability_authority":null,"status":"complete","stage_due":"intake","source_or_file":"chapter.docx:title","linked_components":[],"owner":"volume editor","evidence":["CPR-E-EXAMPLE-TITLE"],"dependency_ids":[],"release_effect":"none","last_checked":"2026-08-13T00:00:00Z"}
